{
  "$schema": "http://json-schema.org/draft-07/schema#",
  "title": "EAC supply v1 candidate",
  "type": "object",
  "additionalProperties": false,
  "required": ["schemaVersion", "sourceId", "sequence", "revision", "generatedAt", "items"],
  "properties": {
    "schemaVersion": { "const": "supply.eac/v1" },
    "sourceId": { "type": "string", "pattern": "^[a-z0-9][a-z0-9._-]{2,99}$" },
    "sequence": { "type": "integer", "minimum": 1, "maximum": 9007199254740991 },
    "revision": { "type": "string", "pattern": "^[A-Za-z0-9][A-Za-z0-9._-]{0,99}$" },
    "generatedAt": { "type": "string", "format": "date-time", "pattern": "Z$" },
    "items": { "type": "array", "maxItems": 10000, "items": { "$ref": "#/definitions/item" } }
  },
  "definitions": {
    "text": { "type": "string", "minLength": 1, "maxLength": 6000, "pattern": "\\S" },
    "https": { "type": "string", "format": "uri", "pattern": "^https://", "maxLength": 4096 },
    "version": { "type": "string", "maxLength": 256 },
    "digest": { "type": "string", "pattern": "^[0-9a-f]{64}$" },
    "source": {
      "type": "object", "additionalProperties": false, "required": ["url", "commit"],
      "properties": {
        "url": { "$ref": "#/definitions/https" },
        "commit": { "anyOf": [{ "type": "null" }, { "type": "string", "pattern": "^[0-9a-f]{40}$" }] },
        "reference": { "$ref": "#/definitions/text" }
      }
    },
    "artifact": {
      "type": "object", "additionalProperties": false,
      "required": ["format", "downloadUrl", "sha256", "size"],
      "properties": {
        "format": { "enum": ["npm-tgz", "eac-feature-pack-v1"] },
        "downloadUrl": { "$ref": "#/definitions/https" },
        "sha256": { "$ref": "#/definitions/digest" },
        "size": { "type": "integer", "minimum": 1, "maximum": 9007199254740991 }
      }
    },
    "authorization": {
      "type": "object", "additionalProperties": false, "required": ["basis", "reference", "redistribution"],
      "properties": {
        "basis": { "enum": ["license", "permission"] },
        "reference": { "$ref": "#/definitions/https" },
        "redistribution": { "type": "boolean" }
      }
    },
    "appearance": {
      "type": "object", "additionalProperties": false,
      "required": ["loadingMode", "skinIds", "skinIdsKnown", "conflicts", "conflictsKnown", "previews"],
      "properties": {
        "loadingMode": { "enum": ["standalone-plugin", "loader-based", "unknown"] },
        "loader": {
          "type": "object", "additionalProperties": false, "required": ["id"],
          "properties": {
            "id": { "$ref": "#/definitions/text" },
            "version": { "$ref": "#/definitions/text" },
            "source": { "$ref": "#/definitions/https" }
          }
        },
        "skinIds": { "type": "array", "maxItems": 64, "uniqueItems": true, "items": { "$ref": "#/definitions/text" } },
        "skinIdsKnown": { "type": "boolean" },
        "conflicts": { "type": "array", "maxItems": 64, "uniqueItems": true, "items": { "$ref": "#/definitions/text" } },
        "conflictsKnown": { "type": "boolean" },
        "conflictsReference": { "$ref": "#/definitions/https" },
        "previews": { "type": "array", "maxItems": 16, "uniqueItems": true, "items": { "$ref": "#/definitions/https" } }
      },
      "allOf": [
        { "if": { "properties": { "loadingMode": { "const": "loader-based" } } }, "then": { "required": ["loader"] }, "else": { "not": { "required": ["loader"] } } },
        { "if": { "properties": { "conflictsKnown": { "const": true } } }, "then": { "required": ["conflictsReference"] } },
        { "if": { "properties": { "skinIdsKnown": { "const": false } } }, "then": { "properties": { "skinIds": { "type": "array", "maxItems": 0 } } } }
      ]
    },
    "component": {
      "type": "object", "additionalProperties": false, "required": ["id", "ref"],
      "properties": {
        "id": { "$ref": "#/definitions/text" },
        "ref": { "$ref": "#/definitions/text" },
        "version": { "$ref": "#/definitions/version" },
        "required": { "type": "boolean" },
        "enabled": { "type": "boolean" },
        "resolved": {
          "type": "object", "additionalProperties": false, "required": ["packageName", "version", "sha256"],
          "properties": {
            "packageName": { "$ref": "#/definitions/text" },
            "version": { "$ref": "#/definitions/version" },
            "sha256": { "$ref": "#/definitions/digest" }
          }
        }
      }
    },
    "execution": {
      "type": "object", "additionalProperties": false, "required": ["coverage", "edges"],
      "properties": {
        "coverage": { "enum": ["unknown", "partial", "complete"] },
        "reference": { "$ref": "#/definitions/https" },
        "edges": {
          "type": "array", "maxItems": 4096, "uniqueItems": true,
          "items": {
            "type": "object", "additionalProperties": false, "required": ["prerequisiteId", "consumerId", "milestone"],
            "properties": {
              "prerequisiteId": { "$ref": "#/definitions/text" },
              "consumerId": { "$ref": "#/definitions/text" },
              "milestone": { "enum": ["installed", "active"] }
            }
          }
        }
      },
      "if": { "properties": { "coverage": { "const": "complete" } } },
      "then": { "required": ["reference"] }
    },
    "item": {
      "type": "object", "additionalProperties": false,
      "required": ["type", "packageName", "version", "name", "summary", "source", "status", "runtime"],
      "properties": {
        "type": { "enum": ["plugin", "skin", "function-pack", "appearance-pack", "material"] },
        "packageName": { "type": "string", "pattern": "^(?:@[a-z0-9._-]+/)?[a-z0-9][a-z0-9._-]*$", "maxLength": 256 },
        "version": { "$ref": "#/definitions/version" },
        "name": { "$ref": "#/definitions/text" },
        "summary": { "$ref": "#/definitions/text" },
        "source": { "$ref": "#/definitions/source" },
        "status": { "enum": ["active", "withdrawn"] },
        "runtime": { "const": "not-tested" },
        "withdrawnReason": { "$ref": "#/definitions/text" },
        "requiresDsh": { "anyOf": [{ "type": "null" }, { "type": "string", "minLength": 1, "maxLength": 256 }] },
        "compatibilityBasis": { "enum": ["author-declared", "maintainer-target", "unknown"] },
        "compatibilityReference": { "$ref": "#/definitions/https" },
        "artifact": { "$ref": "#/definitions/artifact" },
        "license": { "$ref": "#/definitions/text" },
        "authorization": { "$ref": "#/definitions/authorization" },
        "appearance": { "$ref": "#/definitions/appearance" },
        "components": { "type": "array", "minItems": 1, "maxItems": 64, "items": { "$ref": "#/definitions/component" } },
        "execution": { "$ref": "#/definitions/execution" },
        "installable": { "const": false }
      },
      "allOf": [
        { "if": { "properties": { "status": { "const": "withdrawn" } } }, "then": { "required": ["withdrawnReason"] } },
        {
          "if": { "properties": { "type": { "const": "material" } } },
          "then": { "required": ["installable"], "not": { "anyOf": [{ "required": ["artifact"] }, { "required": ["components"] }, { "required": ["execution"] }, { "required": ["appearance"] }, { "required": ["requiresDsh"] }, { "required": ["compatibilityBasis"] }, { "required": ["compatibilityReference"] }] } },
          "else": { "required": ["requiresDsh", "compatibilityBasis"], "not": { "required": ["installable"] } }
        },
        { "if": { "properties": { "type": { "enum": ["function-pack", "appearance-pack"] } } }, "then": { "required": ["components", "execution"], "properties": { "artifact": { "type": "object", "properties": { "format": { "const": "eac-feature-pack-v1" } } } } }, "else": { "not": { "anyOf": [{ "required": ["components"] }, { "required": ["execution"] }] }, "properties": { "artifact": { "type": "object", "properties": { "format": { "const": "npm-tgz" } } } } } },
        { "if": { "properties": { "type": { "const": "skin" } } }, "then": { "required": ["appearance"] } },
        { "if": { "properties": { "type": { "enum": ["plugin", "function-pack"] } } }, "then": { "not": { "required": ["appearance"] } } }
      ]
    }
  }
}
